{"attempt_id":null,"capability_digest":"sha256:bbbbbbbbbbbbbbbbbbbbbbbbbbbbbbbbbbbbbbbbbbbbbbbbbbbbbbbbbbbbbbbb","capability_id":"render.basic","created_at":"2026-08-30T00:00:00Z","idempotency_key":"task-neutral-1","input_object_ids":["object-neutral-1"],"project_id":null,"protocol":"workspace.v1","run_id":"run-neutral-1","runtime_epoch":1,"schema_version":"1","state":"queued","task_id":"task-neutral-1","updated_at":"2026-08-30T00:00:00Z","version":1}
